{
  "fragment_id": "frag-violating-shacl-001",
  "source": { "doc": "risk-control.txt", "span": [0, 210] },
  "entities": [
    { "id": "Risk", "label": "Risk", "gufo": "Kind", "bfo": "GenericallyDependentContinuant", "spans": [[2, 6]] }
  ],
  "relations": [
    {
      "id": "DanglingMitigation",
      "label": "mitigates",
      "gufo": "Relator",
      "bfo": "SpecificallyDependentContinuant",
      "roles": [
        { "role": "mitigatedRisk", "filler": "Risk" }
      ],
      "spans": [[150, 210]]
    }
  ]
}
